{
  "version": "1.0.0",
  "generated_at": "2026-02-16T14:55:32.982853+00:00",
  "packs": [
    {
      "pack_id": "A_DRAWING",
      "label": "Drawing and Specification Completeness",
      "description": "Drawing communication, GPS/GD&T, callouts, and spec integrity checks.",
      "expected_rule_count": 25,
      "trigger_type": "always_base"
    },
    {
      "pack_id": "B_CNC",
      "label": "CNC Machining DFM",
      "description": "Milling and turning manufacturability checks from CAD and linked specs.",
      "expected_rule_count": 25,
      "trigger_type": "process_primary"
    },
    {
      "pack_id": "C_SHEET",
      "label": "Sheet Metal DFM",
      "description": "Bend, flange, relief, and flat-pattern manufacturability checks.",
      "expected_rule_count": 20,
      "trigger_type": "process_primary"
    },
    {
      "pack_id": "D_WELD",
      "label": "Weldment and Fabrication DFM",
      "description": "Weld specification completeness plus weldability and distortion risk checks.",
      "expected_rule_count": 15,
      "trigger_type": "process_primary"
    },
    {
      "pack_id": "E_ASSEMBLY",
      "label": "Assembly, Fixture, and Serviceability",
      "description": "DFA, fixture repeatability, and service access checks.",
      "expected_rule_count": 15,
      "trigger_type": "cross_process"
    },
    {
      "pack_id": "F_OVERLAY",
      "label": "Industry Overlay and Compliance",
      "description": "Domain overlays that add compliance/risk documentation constraints.",
      "expected_rule_count": 30,
      "trigger_type": "overlay_selected"
    }
  ],
  "rules": [
    {
      "rule_id": "SPEC-001",
      "pack_id": "A_DRAWING",
      "title": "General tolerances declared (ISO 2768-1/-2 or equivalent)",
      "description": "General tolerances declared (ISO 2768-1/-2 or equivalent)",
      "applies_to": [
        "drawing"
      ],
      "inputs_required": [
        "drawing_title_block",
        "drawing_notes"
      ],
      "check_logic": {
        "type": "deterministic"
      },
      "severity": "major",
      "fix_template": "Add or correct drawing specification for explicit, measurable intent.",
      "refs": [
        "REF-GPS-3",
        "REF-GPS-4"
      ]
    },
    {
      "rule_id": "SPEC-002",
      "pack_id": "A_DRAWING",
      "title": "GPS fundamentals declared (defaults/interpretation consistent with ISO 8015 framework)",
      "description": "GPS fundamentals declared (defaults/interpretation consistent with ISO 8015 framework)",
      "applies_to": [
        "drawing"
      ],
      "inputs_required": [
        "drawing_notes"
      ],
      "check_logic": {
        "type": "deterministic"
      },
      "severity": "major",
      "fix_template": "Add or correct drawing specification for explicit, measurable intent.",
      "refs": [
        "REF-GPS-1"
      ]
    },
    {
      "rule_id": "SPEC-003",
      "pack_id": "A_DRAWING",
      "title": "Units shown (mm/in) and consistent across drawing",
      "description": "Units shown (mm/in) and consistent across drawing",
      "applies_to": [
        "drawing"
      ],
      "inputs_required": [
        "drawing_title_block"
      ],
      "check_logic": {
        "type": "deterministic"
      },
      "severity": "major",
      "fix_template": "Add or correct drawing specification for explicit, measurable intent.",
      "refs": [
        "REF-GPS-1"
      ]
    },
    {
      "rule_id": "SPEC-004",
      "pack_id": "A_DRAWING",
      "title": "Projection method shown (1st/3rd angle) if multi-view drawing",
      "description": "Projection method shown (1st/3rd angle) if multi-view drawing",
      "applies_to": [
        "drawing"
      ],
      "inputs_required": [
        "drawing_title_block"
      ],
      "check_logic": {
        "type": "deterministic"
      },
      "severity": "major",
      "fix_template": "Add or correct drawing specification for explicit, measurable intent.",
      "refs": [
        "REF-GPS-1"
      ]
    },
    {
      "rule_id": "SPEC-005",
      "pack_id": "A_DRAWING",
      "title": "Material specified (grade + condition/heat treat if relevant)",
      "description": "Material specified (grade + condition/heat treat if relevant)",
      "applies_to": [
        "drawing"
      ],
      "inputs_required": [
        "drawing_title_block",
        "drawing_notes"
      ],
      "check_logic": {
        "type": "deterministic"
      },
      "severity": "major",
      "fix_template": "Add or correct drawing specification for explicit, measurable intent.",
      "refs": [
        "REF-GPS-1"
      ]
    },
    {
      "rule_id": "SPEC-006",
      "pack_id": "A_DRAWING",
      "title": "Surface texture requirement present where function-critical",
      "description": "Surface texture requirement present where function-critical",
      "applies_to": [
        "drawing"
      ],
      "inputs_required": [
        "drawing_notes",
        "surface_finish_spec"
      ],
      "check_logic": {
        "type": "deterministic"
      },
      "severity": "critical",
      "fix_template": "Add or correct drawing specification for explicit, measurable intent.",
      "refs": [
        "REF-GPS-5"
      ]
    },
    {
      "rule_id": "SPEC-007",
      "pack_id": "A_DRAWING",
      "title": "Surface texture symbol includes parameter value (e",
      "description": "Surface texture symbol includes parameter value (e.g., Ra) when used",
      "applies_to": [
        "drawing"
      ],
      "inputs_required": [
        "manual_context"
      ],
      "check_logic": {
        "type": "deterministic"
      },
      "severity": "major",
      "fix_template": "Add or correct drawing specification for explicit, measurable intent.",
      "refs": [
        "REF-GPS-5"
      ]
    },
    {
      "rule_id": "SPEC-008",
      "pack_id": "A_DRAWING",
      "title": "“Deburr/break edges” requirement present if sharp edges unacceptable",
      "description": "“Deburr/break edges” requirement present if sharp edges unacceptable",
      "applies_to": [
        "drawing"
      ],
      "inputs_required": [
        "drawing_notes"
      ],
      "check_logic": {
        "type": "deterministic"
      },
      "severity": "major",
      "fix_template": "Add or correct drawing specification for explicit, measurable intent.",
      "refs": [
        "REF-GPS-1"
      ]
    },
    {
      "rule_id": "SPEC-009",
      "pack_id": "A_DRAWING",
      "title": "Critical features have explicit tolerances (don’t rely only on general tolerances)",
      "description": "Critical features have explicit tolerances (don’t rely only on general tolerances)",
      "applies_to": [
        "drawing"
      ],
      "inputs_required": [
        "manual_context"
      ],
      "check_logic": {
        "type": "deterministic"
      },
      "severity": "critical",
      "fix_template": "Add or correct drawing specification for explicit, measurable intent.",
      "refs": [
        "REF-GPS-3"
      ]
    },
    {
      "rule_id": "SPEC-010",
      "pack_id": "A_DRAWING",
      "title": "GD&T frames use valid symbols and datums",
      "description": "GD&T frames use valid symbols and datums",
      "applies_to": [
        "drawing"
      ],
      "inputs_required": [
        "manual_context"
      ],
      "check_logic": {
        "type": "deterministic"
      },
      "severity": "major",
      "fix_template": "Add or correct drawing specification for explicit, measurable intent.",
      "refs": [
        "REF-GPS-1"
      ]
    },
    {
      "rule_id": "SPEC-011",
      "pack_id": "A_DRAWING",
      "title": "Datum references exist on actual features (not “floating” letters)",
      "description": "Datum references exist on actual features (not “floating” letters)",
      "applies_to": [
        "drawing"
      ],
      "inputs_required": [
        "manual_context"
      ],
      "check_logic": {
        "type": "deterministic"
      },
      "severity": "major",
      "fix_template": "Add or correct drawing specification for explicit, measurable intent.",
      "refs": [
        "REF-GPS-2"
      ]
    },
    {
      "rule_id": "SPEC-012",
      "pack_id": "A_DRAWING",
      "title": "Thread callouts include tolerance class (e",
      "description": "Thread callouts include tolerance class (e.g., 6H/6g system)",
      "applies_to": [
        "drawing",
        "drawing_thread_callout"
      ],
      "inputs_required": [
        "manual_context"
      ],
      "check_logic": {
        "type": "deterministic"
      },
      "severity": "major",
      "fix_template": "Add or correct drawing specification for explicit, measurable intent.",
      "refs": [
        "REF-THR-1"
      ]
    },
    {
      "rule_id": "SPEC-013",
      "pack_id": "A_DRAWING",
      "title": "Thread callouts include pitch (if not coarse default) and length/depth",
      "description": "Thread callouts include pitch (if not coarse default) and length/depth",
      "applies_to": [
        "drawing",
        "drawing_thread_callout"
      ],
      "inputs_required": [
        "manual_context"
      ],
      "check_logic": {
        "type": "deterministic"
      },
      "severity": "major",
      "fix_template": "Add or correct drawing specification for explicit, measurable intent.",
      "refs": [
        "REF-THR-1"
      ]
    },
    {
      "rule_id": "SPEC-014",
      "pack_id": "A_DRAWING",
      "title": "Fasteners in BOM include property class (e",
      "description": "Fasteners in BOM include property class (e.g., 8.8/10.9)",
      "applies_to": [
        "drawing",
        "bom"
      ],
      "inputs_required": [
        "bom_items"
      ],
      "check_logic": {
        "type": "deterministic"
      },
      "severity": "major",
      "fix_template": "Add or correct drawing specification for explicit, measurable intent.",
      "refs": [
        "REF-BLT-1"
      ]
    },
    {
      "rule_id": "SPEC-015",
      "pack_id": "A_DRAWING",